{
  "schema_version": "0.1.0",
  "event_id": "event-context-changed",
  "job_id": "job-1",
  "request_id": "request-1",
  "review_id": "review-1",
  "execution_id": "cloud-run-execution-1",
  "attempt_id": "attempt-1",
  "sequence": 9,
  "occurred_at": "2026-10-01T12:05:00Z",
  "kind": "authoritative_context_changed",
  "stage_id": "compose",
  "message": "Review continues against the supplied requirements; Deltahub should schedule a new request.",
  "expected_report_revision": null,
  "report": null,
  "report_artifact": null,
  "failure": null,
  "quota_wait": null,
  "job_lineage": {
    "original_job_id": "job-1",
    "retry_of_job_id": null
  },
  "checkpoint": {
    "artifact_id": "context-change-checkpoint",
    "kind": "checkpoint",
    "uri": "gs://example-private-review/artifacts/context-change-checkpoint.json",
    "generation": "1",
    "sha256": "aaaaaaaaaaaaaaaaaaaaaaaaaaaaaaaaaaaaaaaaaaaaaaaaaaaaaaaaaaaaaaaa",
    "content_type": "application/json"
  },
  "stop": null,
  "check": null,
  "context_change": {
    "change_id": "jira-change-1",
    "snapshot_source_id": "jira-description",
    "snapshot_sha256": "bbbbbbbbbbbbbbbbbbbbbbbbbbbbbbbbbbbbbbbbbbbbbbbbbbbbbbbbbbbbbbbb",
    "observed_source": {
      "source_id": "jira-description-new",
      "system": "jira",
      "type": "ticket",
      "uri": "https://example.atlassian.net/browse/EX-123",
      "observed_at": "2026-10-01T12:03:00Z"
    },
    "observed_artifact": {
      "artifact_id": "jira-new-requirements",
      "kind": "context_observation",
      "uri": "gs://example-private-review/artifacts/jira-new-requirements.json",
      "generation": "1",
      "sha256": "aaaaaaaaaaaaaaaaaaaaaaaaaaaaaaaaaaaaaaaaaaaaaaaaaaaaaaaaaaaaaaaa",
      "content_type": "application/json"
    },
    "reason": "New acceptance criteria were added after the payload snapshot.",
    "policy": "continue_snapshot",
    "new_request_required": true
  }
}
