{
  "schema_version": "0.1.0",
  "event_id": "event-9",
  "job_id": "job-1",
  "request_id": "request-1",
  "review_id": "review-1",
  "execution_id": "cloud-run-execution-1",
  "attempt_id": "attempt-1",
  "sequence": 9,
  "occurred_at": "2026-10-01T12:05:00Z",
  "kind": "review_completed",
  "stage_id": "compose",
  "message": "Computation checkpointed; publication and final report are next.",
  "expected_report_revision": null,
  "report": null,
  "report_artifact": null,
  "failure": null,
  "quota_wait": null,
  "job_lineage": {
    "original_job_id": "job-1",
    "retry_of_job_id": null
  },
  "checkpoint": {
    "artifact_id": "computation",
    "kind": "checkpoint",
    "uri": "gs://example-private-review/review-1/jobs/job-1/computation.json",
    "generation": "1",
    "sha256": "3333333333333333333333333333333333333333333333333333333333333333",
    "content_type": "application/json"
  },
  "stop": null,
  "check": null,
  "context_change": null
}
